224c8e3f-e363-4aff-9c7b-25c2f8bb575e,160,2016/01/04 17:08:38.601,2016/01/04 17:08:37.642,0.82380855,98.97959,0.19660157,0.496864,0.85716325,,1.172272,98.6727,0.15502566,0.49334288,0.85716325,,1.9323474,97.96838,0.09926543,0.48982173,0.8500939,,97.39465,0.20407867,2.4012616,0.02503301,0.0017673358,,0.3495337,52.040817,47.60965,0.7363006,0.45067346,,0.063530274,99.79592,0.14055176,0.5003851,0.86423266,,0.028435968,98.515366,1.4561977,0.5074274,0.8536285,,0.008333572,95.69833,4.293332,0.5215119,0.8288857,,93.62921,6.3265314,0.044261176,0.032075264,0.05478777,,0.043415222,2.653061,97.30353,0.9863006,0.02297552,,0.99954545,4.5454546E-4,4.5454546E-4,,positive,it's somewhat common,,,1,,,,,,,1,,,,,,,,,,,,,,,,,,,,,,,,,,,,,,1,,,1,,,,,,,1,,,,,,,,,,,45-49,female,postgraduate masters,,,,,1,,,,urban area,Center,1,,,,,1,,,,,Am participat the intruire.,n/a,0.77769077,0.75575656,0.44739464,0.6965461,0.1581008,0.7393092,0.7549117,0.64391446,foimoldova2015,SenseMaker New WebCollector; Mozilla/5.0 (Windows NT 6.1; WOW64) AppleWebKit/537.36 (KHTML like Gecko) Chrome/47.0.2526.106 Safari/537.36,,,ro
2340a2e8-01b3-4dde-8d97-6bacec38fba8,161,2016/01/04 15:39:05.871,2016/01/04 15:39:05.055,83.54585,9.591835,6.862314,0.116582304,0.083065294,,0.991958,96.5306,2.4774365,0.5074274,0.8359551,,6.3972473,7.551018,86.051735,0.89827245,0.06539184,,7.4535856,7.551018,84.9954,0.8877091,0.06539184,,2.252378,96.12245,1.625171,0.496864,0.8324204,,1.172272,98.6727,0.15502566,0.49334288,0.85716325,,86.939064,6.326531,6.7344017,0.09897667,0.05478777,,88.95976,5.1020355,5.9381995,0.08489217,0.044183653,,,,,,,1,6.6013227,7.1428604,86.25582,0.89827245,0.061857164,,0.06863636,0.93136364,0.93136364,,negative,it's very common,,,,1,1,,1,,,,,,,,,1,,,,,,,1,1,,1,,,,,1,,,1,,,1,1,,,1,,,,,1,,,,,,,,1,,1,1,,,,45-49,female,complete technical/vocational,,,,1,,,,,rural area,Center,1,1,,,,,,,1,gospodarie,It worries the situation in the country. The arrest of Mr Filat.,as truth,0.15582289,0.71957237,0.7913582,0.7294408,0.4747295,0.73273027,0.795914,0.23273027,foimoldova2015,SenseMaker New WebCollector; Mozilla/5.0 (Windows NT 6.1; WOW64) AppleWebKit/537.36 (KHTML like Gecko) Chrome/47.0.2526.106 Safari/537.36,,,ro
2362b8a2-7dae-46ea-b201-f21736a2a912,162,2016/01/04 23:43:31.178,2016/01/04 23:43:30.262,32.01236,34.4898,33.49784,0.5074274,0.29868165,,,,,,,1,33.47687,33.67347,32.849663,0.496864,0.29161227,,79.46853,10.0,10.531469,0.1553147,0.08660002,,10.733262,41.83673,47.430008,0.6834837,0.36230612,,34.089115,32.448975,33.46191,0.496864,0.28100815,,,,,,,1,45.757683,11.224487,43.017822,0.48630062,0.09720409,,,,,,,1,,,,,,1,0.028636336,0.97136366,0.97136366,,strongly negative,it's very common,1,,,,,,,,,,,,,,,1,,,,,1,,1,1,,,,,,,1,,1,1,,1,1,1,1,1,1,1,1,,,1,,1,,1,,,,,,,,1,,,25-29,male,complete technical/vocational,,,,,,,1,la lucru,rural area,North,1,1,1,,,1,,,,,Knead problem that I was always the lack of November finantedeoarace I mean younger people have not even work dacagasesti where a very bad job is paid. Where you have young children and also to build it yourself at the beginning that you do not get anything pine earned money in Moldova.,Jobs pn you and underpaid,0.15126708,0.265625,0.48384112,0.27549344,0.8300826,0.7162829,0.82324886,0.17351973,foimoldova2015,SenseMaker New WebCollector; Mozilla/5.0 (Windows NT 6.1; WOW64) AppleWebKit/537.36 (KHTML like Gecko) Chrome/47.0.2526.106 Safari/537.36,,,ro
24c27fc0-a03e-4bd9-bcef-950c44034450,163,2016/01/04 15:49:15.830,2016/01/04 15:49:14.985,1.6041992,95.30612,3.0896778,0.5074274,0.825351,,0.053466797,51.224495,48.722042,0.7433429,0.4436041,,1.4159265,0.61224365,97.971825,0.9827795,0.005302059,,,,,,,1,1.563964,1.0204086,97.41563,0.97925836,0.00883673,,1.2118449,1.0204086,97.767746,0.9827795,0.00883673,,1.5481495,96.12245,2.3293993,0.50390625,0.8324204,,,,,,,1,,,,,,1,0.65565395,1.4285736,97.91577,0.9863006,0.012371453,,0.98136365,0.018636364,0.018636364,,strongly positive,it's very common,1,,1,,,,,,,,,,,,,,,1,,,,,,,,,,,,,,,,,,,,1,,,,,,,,,,,,,,,,,,1,,,,,40-44,female,university degree,,,,,,,1,munca,urban area,Center,,1,1,,,1,,,,,My child birth. Afost a much anticipated event.,Preamultasteptata joy.,0.14443336,0.73273027,0.44967255,0.7097039,0.13304386,0.7294408,0.7981919,0.23601973,foimoldova2015,SenseMaker New WebCollector; Mozilla/5.0 (Windows NT 6.1; WOW64) AppleWebKit/537.36 (KHTML like Gecko) Chrome/47.0.2526.106 Safari/537.36,,,ro
2805862d-9588-4e40-8000-e6514738bf60,164,2016/01/05 01:15:50.048,2016/01/05 01:15:49.036,0.3236621,98.57143,1.104912,0.50390625,0.8536285,,67.21645,14.0816345,18.701918,0.25742736,0.121946946,,27.79851,47.142857,25.058636,0.48630062,0.40825716,,34.293194,32.040817,33.665985,0.496864,0.27747348,,34.997414,32.040817,32.96176,0.48982173,0.27747348,,16.752232,15.714288,67.53348,0.75390625,0.13608573,,16.663128,42.653065,40.68381,0.6201034,0.3693755,,33.94108,32.040817,34.0181,0.5003851,0.27747348,,1.2880175,97.34695,1.365039,0.5003851,0.8430245,,0.17586364,97.81801,2.006132,0.5109485,0.8500939,,0.0031818151,0.9968182,0.9968182,,negative,it's rare but happens occasionally,1,,,,,,,,,,,,,,,,,1,1,,,,,,,,,,1,1,,,,1,,,1,,,,,,,,,1,,,,1,,1,,,,,,1,,,40-44,female,incomplete technical/vocational,,1,,,,,,,urban area,Center,,1,,,,1,,,,,Changes in society.,Changes in associative.,0.1603787,0.24588817,0.11937642,0.74917763,0.45650625,0.20641446,0.8596953,0.7524671,foimoldova2015,SenseMaker New WebCollector; Mozilla/5.0 (Windows NT 6.1; WOW64) AppleWebKit/537.36 (KHTML like Gecko) Chrome/47.0.2526.106 Safari/537.36,,,ro
329b33e9-ebe7-46f6-95d0-9f43a88d7946,165,2016/01/04 20:42:53.771,2016/01/04 20:42:53.125,9.339185,82.65306,8.007759,0.49334288,0.7157755,,50.35959,0.61224365,49.028164,0.49334288,0.005302059,,97.48664,1.4285736,1.084789,0.017990757,0.012371453,,97.98678,1.8367386,0.17648102,0.010948503,0.015906125,,96.33832,0.20407867,3.4575994,0.03559639,0.0017673358,,0.21155107,0.20407867,99.584366,0.996864,0.0017673358,,,,,,,1,0.56367016,0.20407867,99.23225,0.9933429,0.0017673358,,,,,,,1,1.9323474,97.96838,0.09926543,0.48982173,0.8500939,,0.014090896,0.9859091,0.9859091,,negative,it's very common,,1,,,1,,,,,,,,,,,,,1,,,,,,,,,,,,,,,,1,,,1,,1,1,,,,,,1,,,,,,,,,,,,,,,60 and over,female,incomplete technical/vocational,,,,1,,,,,urban area,Center,,,,,1,,1,,,,Doctor's attitude toward patient was operated .They have thought to go to see the doctor a patient after surgery. Adar one came the next morning when do abhod. After passing was satisfied only come once in a while.,Dr. attitude towards the patient.,0.16721241,0.32154608,0.38816914,0.2886513,0.49523064,0.27220392,0.84375,0.69983554,foimoldova2015,SenseMaker New WebCollector; Mozilla/5.0 (Windows NT 6.1; WOW64) AppleWebKit/537.36 (KHTML like Gecko) Chrome/47.0.2526.106 Safari/537.36,,,ro
3b46fa36-2592-4076-b183-23b9b600937c,166,2016/01/05 00:42:24.048,2016/01/05 00:42:23.262,2.4823291,49.183674,48.334,0.72925836,0.4259306,,0.09438692,50.720398,49.185215,0.746864,0.4400694,,2.3601725,2.244896,95.394936,0.96517384,0.019440796,,49.63524,3.4693909,46.895367,0.48630062,0.030044915,,0.03848598,49.961514,50.0,0.7503851,0.433,,1.4518625,2.653061,95.89507,0.9722161,0.02297552,,48.48693,2.244896,49.26818,0.50390625,0.019440796,,2.9566016,96.12245,0.92094725,0.48982173,0.8324204,,,,,,,1,48.578907,3.4693909,47.9517,0.496864,0.030044915,,0.4613636,0.5386364,0.5386364,,positive,it's rare but happens occasionally,,,,1,1,,,,1,1,,,,,1,1,,1,,,,,,1,,1,1,coruptionerii,1,1,1,,,1,1,,1,1,1,1,,,,,,,,,,1,,,,,,1,1,,1,corectitudine,50-54,male,university degree,1,,1,,1,,1,odihna,urban area,Center,1,1,,,,1,,,1,rezerve,"I attended the peaceful protest organized in the Grand National Assembly Pita spent the day of September 6, 2015.",Democracy in action,0.12165433,0.79523027,0.4200598,0.58141446,0.098875284,0.21299344,0.7526338,0.21957237,foimoldova2015,SenseMaker New WebCollector; Mozilla/5.0 (Windows NT 6.1; WOW64) AppleWebKit/537.36 (KHTML like Gecko) Chrome/47.0.2526.106 Safari/537.36,,,ro
3b7b56d0-6fb3-4add-8b0e-2a00b3d060f8,167,2016/01/04 23:34:23.046,2016/01/04 23:34:22.155,2.1862695,48.367344,49.446384,0.7363006,0.4188612,,1.4921045,96.938774,1.569126,0.5003851,0.8394898,,0.25754884,50.816326,48.926125,0.7433429,0.4400694,,49.895382,2.244896,47.859726,0.48982173,0.019440796,,2.538374,48.367344,49.094284,0.7327795,0.4188612,,33.47687,33.67347,32.849663,0.496864,0.29161227,,1.2678987,0.20407867,98.528015,0.9863006,0.0017673358,,49.869507,48.775513,1.3549805,0.25742736,0.42239594,,,,,,,1,47.032486,51.63265,1.3348633,0.27151188,0.4471388,,,,,1,negative,it's somewhat common,1,,,1,1,,,,,,,,,,,1,,,,,,,1,1,,,,,1,1,1,1,1,1,1,,1,1,1,1,1,1,1,,,1,,,,1,,,,,,1,,,,,60 and over,male,complete technical/vocational,,,,,,,1,serv. militar,rural area,North,,1,,,,,1,,,,Lately on TV than country situation worries me. A small country but poor and stolen. Knead me that people made to have a government that we could improve life. How to get rid of Aligarh.,We want a better life.,0.43372723,0.2787829,0.076096244,0.265625,0.105709,0.22286183,0.7936361,0.15049344,foimoldova2015,SenseMaker New WebCollector; Mozilla/5.0 (Windows NT 6.1; WOW64) AppleWebKit/537.36 (KHTML like Gecko) Chrome/47.0.2526.106 Safari/537.36,,,ro
3b8ecaa9-52c6-4cf0-a4fa-32975ec871ad,168,2016/01/04 20:02:21.821,2016/01/04 20:02:21.300,1.172272,98.6727,0.15502566,0.49334288,0.85716325,,96.69043,0.20407867,3.105487,0.032075264,0.0017673358,,0.56367016,0.20407867,99.23225,0.9933429,0.0017673358,,1.620008,0.20407867,98.1759,0.9827795,0.0017673358,,3.0284553,0.20407867,96.76746,0.968695,0.0017673358,,0.82380855,98.97959,0.19660157,0.496864,0.85716325,,,,,,,1,0.119580075,98.97959,0.90083003,0.50390625,0.85716325,,,,,,,1,0.119580075,98.97959,0.90083003,0.50390625,0.85716325,,,,,1,negative,it's somewhat common,1,,,,,,,,,1,,,,,,,,,,,,,,,,,1,,,,,,,,,,,,,,,,,1,problema de gender,,,,,1,,,,,,,,,,,45-49,female,university degree,,1,,,1,1,,,urban area,Center,1,1,,,,1,,,,,A group of MPs (men) participated in a seminar (abroad) entitled Women in politics.,Men seminar about women in politics.,0.1581008,0.28207237,0.43372723,0.22944081,,,,,foimoldova2015,SenseMaker New WebCollector; Mozilla/5.0 (Windows NT 6.1; WOW64) AppleWebKit/537.36 (KHTML like Gecko) Chrome/47.0.2526.106 Safari/537.36,,,ro
3f978816-0528-43d1-bbac-61a9784c60a8,169,2016/01/04 21:29:59.777,2016/01/04 21:29:59.055,0.14545165,52.448982,47.405567,0.7363006,0.45420814,,35.405582,31.224485,33.36993,0.48982173,0.27040407,,1.461919,51.224495,47.313587,0.72925836,0.4436041,,0.21155107,0.20407867,99.584366,0.996864,0.0017673358,,1.2678987,0.20407867,98.528015,0.9863006,0.0017673358,,51.247776,3.061226,45.690994,0.4722161,0.026510192,,52.67635,0.20407867,47.119568,0.4722161,0.0017673358,,0.21155107,0.20407867,99.584366,0.996864,0.0017673358,,,,,,,1,0.5176782,49.591843,49.89048,0.746864,0.42946532,,0.0068181753,0.9931818,0.9931818,,positive,it's very common,,,1,,,,,,,,,,,,,,,1,,,,,,,,,,,,,1,,,,,,1,,1,1,,1,,,,1,,,,,,,,,,,,,,,25-29,male,complete technical/vocational,,,,,,,1,Lucru,rural area,North,1,1,,1,,1,,,,,She enjoys it when mia proposed we go to work in Chisinau. But from mia I changed my mind.,In search of work.,0.13759966,0.7458881,0.4200598,0.6307566,0.8483058,0.79851973,0.76402336,0.6965461,foimoldova2015,SenseMaker New WebCollector; Mozilla/5.0 (Windows NT 6.1; WOW64) AppleWebKit/537.36 (KHTML like Gecko) Chrome/47.0.2526.106 Safari/537.36,,,ro
49b9e668-efe9-4342-b655-4cd6f3dea398,170,2016/01/04 16:04:58.793,2016/01/04 16:04:57.944,0.14545165,52.448982,47.405567,0.7363006,0.45420814,,1.563964,1.0204086,97.41563,0.97925836,0.00883673,,1.7119918,1.4285736,96.85943,0.9757372,0.012371453,,97.54269,0.61224365,1.8450664,0.021511884,0.005302059,,0.47169435,98.97959,0.54871583,0.5003851,0.85716325,,97.430595,2.244896,0.32451493,0.01446963,0.019440796,,95.37396,1.4285736,3.1974652,0.03911752,0.012371453,,1.0638171,0.61224365,98.32394,0.9863006,0.005302059,,1.9922413,97.34695,0.6608154,0.49334288,0.8430245,,98.451,0.20407867,1.3449236,0.01446963,0.0017673358,,,,,1,negative,it's very common,,,,,,1,,,,,,,,,,1,,,,,,,,1,,,,,,,,,,,,,,,1,,,,,,,,,,,1,,,,,,,,,,,60 and over,female,incomplete technical/vocational,,,,1,,,,,urban area,Center,,,,,1,,1,,,,I had plans to invite guests to prepare a meal from serbatoare I was worried financeara fall in money.,Veaţa heavy high prices.,0.18315774,0.22615129,0.5134539,0.2919408,0.4291714,0.2524671,0.7913582,0.7393092,foimoldova2015,SenseMaker New WebCollector; Mozilla/5.0 (Windows NT 6.1; WOW64) AppleWebKit/537.36 (KHTML like Gecko) Chrome/47.0.2526.106 Safari/537.36,,,ro
53e7ecac-c0fa-42af-9e37-44a0b575c565,171,2016/01/04 18:05:11.613,2016/01/04 18:05:10.570,,,,,,1,34.589252,32.85715,32.553596,0.48982173,0.28454286,,33.82898,33.67347,32.497555,0.49334288,0.29161227,,9.636684,47.551014,42.8123,0.66587806,0.4117918,,0.46163085,50.408165,49.130203,0.7433429,0.43653467,,33.88503,32.85715,33.25782,0.496864,0.28454286,,32.06842,33.67347,34.258114,0.5109485,0.29161227,,,,,,,1,1.5481495,96.12245,2.3293993,0.50390625,0.8324204,,33.88503,32.85715,33.25782,0.496864,0.28454286,,0.99954545,4.5454546E-4,4.5454546E-4,,positive,it's somewhat common,,,,,,1,,,,1,,,,,,,,,,,,,,1,,,,,,,,,,,,,,1,,1,,,,,,1,,,,,,,,,,,,,,,25-29,female,postgraduate masters,,1,,,1,,,,rural area,Center,,,1,,,1,,,,,I came silently Experience p / d engaging for me Employment. It is a unique experience that opened my door to continuous development.,The first work experience,0.22188212,0.79851973,0.10343109,0.83141446,0.19682518,0.67351973,0.10115319,0.6472039,foimoldova2015,SenseMaker New WebCollector; Mozilla/5.0 (Windows NT 6.1; WOW64) AppleWebKit/537.36 (KHTML like Gecko) Chrome/47.0.2526.106 Safari/537.36,,,ro
66f2f0f9-a25c-40c8-bc2f-723c808be1c6,172,2016/01/04 20:27:51.647,2016/01/04 20:27:51.038,1.2650219,72.04082,26.694164,0.6271457,0.6238735,,20.521992,1.8367386,77.641266,0.7855964,0.015906125,,,,,,,1,1.9721272,0.20407867,97.823784,0.97925836,0.0017673358,,99.50733,0.20407867,0.28858566,0.00390625,0.0017673358,,,,,,,1,1.620008,0.20407867,98.1759,0.9827795,0.0017673358,,0.21155107,0.20407867,99.584366,0.996864,0.0017673358,,,,,,,1,,,,,,1,,,,1,neutral,it's a one-time occurrence,,,1,,,,,,,,,,,,,,,1,,,,,,,,,,,,,,,,,,,,,,,,,,1,dragoste,,,,,,,,,,1,1,,,,,20-24,female,complete technical/vocational,,,,1,,,,,urban area,Center,,,,,1,1,,,,,I had positive emotions when he asked me to marry him ... I was very surprised unexpected situation very spontaneous ... I was filled with happiness positive emotions.,Sincerity.,0.14215547,0.7458881,0.5407887,0.64391446,0.3722238,0.74259865,0.8323605,0.7162829,foimoldova2015,SenseMaker New WebCollector; Mozilla/5.0 (Windows NT 6.1; WOW64) AppleWebKit/537.36 (KHTML like Gecko) Chrome/47.0.2526.106 Safari/537.36,,,ro
67c17794-1073-4d74-9e73-30930c0e590e,173,2016/01/04 16:26:58.174,2016/01/04 16:26:57.285,0.3236621,98.57143,1.104912,0.50390625,0.8536285,,,,,,,1,,,,,,1,1.620008,0.20407867,98.1759,0.9827795,0.0017673358,,0.063530274,99.79592,0.14055176,0.5003851,0.86423266,,,,,,,1,94.797646,4.6938777,0.5084747,0.028554138,0.040648982,,98.451,0.20407867,1.3449236,0.01446963,0.0017673358,,,,,,,1,99.30325,0.61224365,0.084503174,0.00390625,0.005302059,,0.0104545355,0.98954546,0.98954546,,strongly negative,it's rare but happens occasionally,,,1,,1,,,,1,,,,,,,,,,,,,,,,,,,,,,,,,,,,,1,1,,,,,,,,,,,1,,,1,,,,,,,,50-54,female,incomplete technical/vocational,,,,1,,,,,urban area,Center,,,,,1,1,,,,,When I got home I noticed that ţiava was broken. It required additional expenses. Unforeseen repair.,stress.,0.14215547,0.23601973,0.46333998,0.24917763,0.43600512,0.6768092,0.7981919,0.7458881,foimoldova2015,SenseMaker New WebCollector; Mozilla/5.0 (Windows NT 6.1; WOW64) AppleWebKit/537.36 (KHTML like Gecko) Chrome/47.0.2526.106 Safari/537.36,,,ro
6e571b0d-7dc7-4e38-a6be-6ef513ed3115,174,2016/01/04 21:04:19.205,2016/01/04 21:04:18.552,32.976723,33.265305,33.757973,0.50390625,0.28807753,,,,,,,1,,,,,,1,0.084359385,99.22007,0.6955725,0.50390625,0.8606979,,1.172272,98.6727,0.15502566,0.49334288,0.85716325,,,,,,,1,0.9157893,0.20407867,98.88013,0.98982173,0.0017673358,,,,,,,1,0.084359385,99.22007,0.6955725,0.50390625,0.8606979,,,,,,,1,,,,1,negative,it's rare but happens occasionally,,,,,,1,,,1,,,,,,,,,,,,,,,,,,,,,,,,,,,1,,,,,,,,,,,,,,,,1,,,,,,,,,40-44,female,university degree,,1,,,,,,,urban area,Center,,1,,,,1,,,,,X conducted an LLC to a street excavation works without the consent of residents. While performing reached aqueduct pipe in result I remained without water. While we appealed to SA Water-channel hall or SRL X measures were not taken for two months. Concern!,What does operation unless citizens take action calls.,0.22188212,0.6504934,0.16493452,0.25904608,0.12848803,0.26233554,,,foimoldova2015,SenseMaker New WebCollector; Mozilla/5.0 (Windows NT 6.1; WOW64) AppleWebKit/537.36 (KHTML like Gecko) Chrome/47.0.2526.106 Safari/537.36,,,ro
6fa7c1f6-4434-4065-9201-7122c2f44252,175,2016/01/04 20:22:34.164,2016/01/04 20:22:33.547,0.119580075,98.97959,0.90083003,0.50390625,0.85716325,,,,,,,1,2.6116755,16.530617,80.85771,0.89123017,0.14315513,,9.158097,8.367348,82.474556,0.86658233,0.07246123,,0.56367016,0.20407867,99.23225,0.9933429,0.0017673358,,,,,,,1,1.5912641,18.571434,79.837296,0.89123017,0.16082859,,28.790173,63.46939,7.740437,0.3947513,0.5496449,,,,,,,1,,,,,,1,0.057727277,0.9422727,0.9422727,,negative,it's rare but happens occasionally,1,,,,,,,,,,,,1,,,,,,,,,,,,,,,,,1,,,,,,1,,1,,,,,,,,,,,,,,,,,,,1,,,,35-39,female,postgraduate other,,1,,,1,1,,,urban area,Center,1,1,,,,1,,,,,The child came home from school had sad-point test and essay l.romina has got 0 points. He did not understand what he wrote essay is bad ... and then ... creativity. More prof. Of l.rom in the class read essays less successful ... children stressed. November confused parents worried sad kill creativity + humiliation.,School - we support environment where we develop or humble?,0.19226936,0.20970392,0.105709,0.28207237,,,,,foimoldova2015,SenseMaker New WebCollector; Mozilla/5.0 (Windows NT 6.1; WOW64) AppleWebKit/537.36 (KHTML like Gecko) Chrome/47.0.2526.106 Safari/537.36,,,ro
7170100d-a737-4710-a28b-c513814fd29a,176,2016/01/04 16:21:38.502,2016/01/04 16:21:37.625,2.0209913,78.97958,18.999418,0.58489215,0.6839633,,12.102908,11.632652,76.264435,0.82080764,0.10073876,,0.19143327,3.061226,96.74733,0.9827795,0.026510192,,0.9157893,0.20407867,98.88013,0.98982173,0.0017673358,,0.49755615,52.448982,47.053467,0.7327795,0.45420814,,0.67577636,98.57143,0.75279784,0.5003851,0.8536285,,98.09888,0.20407864,1.6970363,0.017990757,0.0017673358,,97.746765,0.20407867,2.049149,0.021511884,0.0017673358,,,,,,,1,1.0839355,97.75511,1.160957,0.5003851,0.8465592,,,,,1,strongly negative,it's very common,1,,1,,,,,,,1,,,,,,,,,,,,,,,,,,,,,,,1,,,,,1,,,,,,,,1,,,,1,,,,,,,,,,,25-29,female,postgraduate masters,,,,,1,,,,urban area,Center,,,1,,,1,,,,,I had had a fight with accounting serviciul.M. She has no jurisdiction. I was very aggressive due date.,arrogant people,0.15354499,0.23601973,0.14443336,0.23601973,0.21732631,0.2787829,0.8004698,0.70641446,foimoldova2015,SenseMaker New WebCollector; Mozilla/5.0 (Windows NT 6.1; WOW64) AppleWebKit/537.36 (KHTML like Gecko) Chrome/47.0.2526.106 Safari/537.36,,,ro
723866f0-6bca-407d-a9a0-d247dff41d7a,177,2016/01/04 23:54:04.866,2016/01/04 23:54:03.950,0.3610254,64.69387,34.9451,0.67292035,0.560249,,,,,,,1,,,,,,1,47.578625,2.653061,49.76832,0.5109485,0.02297552,,1.6818116,55.714287,42.6039,0.70461047,0.4824857,,,,,,,1,,,,,,1,94.14947,3.8775482,1.9729779,0.03911752,0.033579584,,,,,,,1,,,,,,1,,,,1,negative,it's somewhat common,,1,1,,1,,,,1,1,,,,,,,,,,,,,,,,,,,,,,,,1,,1,1,,,,1,,,,,1,,,,,,,,,,,,,,,35-39,female,university degree,,1,,,1,1,1,odihnarecreere,urban area,Center,1,1,,,,1,,,,,Pedagagica University near Ion Luca lick Dendrariu park in front of the club dance Condreanca began a construction of an apartment building. The construction is carried out in violation of rules and generally should not be authorized in place.,In Chisinau continues breaches constrctie.,0.8551395,0.19983554,0.7093536,0.22286183,0.7981919,0.33470392,0.12621014,0.7590461,foimoldova2015,SenseMaker New WebCollector; Mozilla/5.0 (Windows NT 6.1; WOW64) AppleWebKit/537.36 (KHTML like Gecko) Chrome/47.0.2526.106 Safari/537.36,,,ro
73d66349-1b65-41af-8aff-ebef9362e364,178,2016/01/04 22:48:34.959,2016/01/04 22:48:34.148,2.252378,96.12245,1.625171,0.496864,0.8324204,,,,,,,1,0.1353952,3.8775482,95.98706,0.97925836,0.033579584,,98.451,0.20407867,1.3449236,0.01446963,0.0017673358,,1.9323474,97.96838,0.09926543,0.48982173,0.8500939,,33.384888,32.448975,34.166138,0.50390625,0.28100815,,,,,,,1,48.52285,4.285721,47.191425,0.49334288,0.03711431,,,,,,,1,,,,,,1,,,,1,negative,it's very common,1,,,1,1,,,,,,,,,,,1,,,,,,,,1,,,,,,,1,,,,,,1,1,1,1,1,1,,,,,,,,1,,,,,,,,,,,45-49,male,incomplete technical/vocational,,,,,,,1,lucru,rural area,North,1,,,,,1,,,,,Even sptamina I received this salary. It is one miserable. Pay bills and buy some cheaper products of poor quality and it ends with money. Pay a contract to study for a child (where ???) to subscribe to a newspaper to cumperio book (what ???) to do your treatment (where money ???). Work only for spiritual satisfaction!,Life in Moldova budget.,0.20821469,0.27549344,0.43828303,0.2919408,0.8278047,0.19654608,0.8870302,0.76891446,foimoldova2015,SenseMaker New WebCollector; Mozilla/5.0 (Windows NT 6.1; WOW64) AppleWebKit/537.36 (KHTML like Gecko) Chrome/47.0.2526.106 Safari/537.36,,,ro
7587e834-8889-4e33-9958-7f9889403202,179,2016/01/05 01:22:24.106,2016/01/05 01:22:23.061,52.55131,25.102043,22.346645,0.34897667,0.2173837,,34.32912,34.081635,31.589245,0.48630062,0.29514694,,6.992241,37.346943,55.660812,0.7433429,0.32342452,,,,,,,1,3.2785304,50.408165,46.313305,0.71517384,0.43653467,,4.6481867,20.204077,75.147736,0.8524978,0.17496732,,45.46163,10.408165,44.130207,0.49334288,0.090134695,,,,,,,1,47.502445,6.326531,46.17102,0.49334288,0.05478777,,1.957749,59.387756,38.6545,0.6834837,0.51429796,,0.825,0.175,0.175,,positive,it's rare but happens occasionally,1,,,,,,,,,1,,1,,1,,,,1,,1,,,,,1,1,,,1,1,1,1,,,,,,1,,,1,,1,,,1,,,,1,1,,,,,1,,,,,40-44,female,postgraduate PhD,1,1,,,1,,,,urban area,Center,,1,,,,1,,,,,Detaching people in international travel,femeelor ​​role in peace keeping missions.,0.14898919,0.6965461,0.12621014,0.77549344,0.7685792,0.2524671,0.41550398,0.27549344,foimoldova2015,SenseMaker New WebCollector; Mozilla/5.0 (Windows NT 6.1; WOW64) AppleWebKit/537.36 (KHTML like Gecko) Chrome/47.0.2526.106 Safari/537.36,,,ro
79e89ca9-6290-4a68-87d7-11abd2efbbef,180,2016/01/04 19:30:52.371,2016/01/04 19:30:51.824,1.0408204,75.30612,23.653057,0.6130612,0.65215105,,0.58954346,53.67347,45.736984,0.7257372,0.46481225,,1.2736474,56.530613,42.195736,0.70461047,0.4895551,,98.74706,1.0204086,0.23253334,0.0074273767,0.00883673,,0.23742919,53.67347,46.0891,0.72925836,0.46481225,,33.32884,33.265305,33.405857,0.5003851,0.28807753,,,,,,,1,48.80311,0.20407867,50.992805,0.5109485,0.0017673358,,,,,,,1,,,,,,1,0.024999976,0.975,0.975,,strongly negative,it's rare but happens occasionally,,,,1,1,,,,,1,,,,,,1,,,,,,,,1,,,,,,,,,1,,,,,,,,,,,,,1,,,,,,,1,,,,,,1,sanatate,25-29,female,university degree,1,1,,,,1,,,rural area,South,,,1,,,1,,,,,It lifted the EUR / USD price increase which affected the company's products that enable.,Depricierea lion makes us poorer.,0.14671127,0.29851973,0.44739464,0.24259871,0.14898919,0.35773027,0.75718963,0.7458881,foimoldova2015,SenseMaker New WebCollector; Mozilla/5.0 (Windows NT 6.1; WOW64) AppleWebKit/537.36 (KHTML like Gecko) Chrome/47.0.2526.106 Safari/537.36,,,ro
7e6324c9-694a-4075-af8e-dd2be40a4444,181,2016/01/04 19:25:35.578,2016/01/04 19:25:35.050,2.0051782,74.081635,23.913185,0.60954005,0.64154696,,50.36965,49.183674,0.44667727,0.25038514,0.4259306,,33.82898,33.67347,32.497555,0.49334288,0.29161227,,0.9359033,97.34695,1.7171534,0.50390625,0.8430245,,32.568558,34.081635,33.349808,0.50390625,0.29514694,,,,,,,1,0.65565395,1.4285736,97.91577,0.9863006,0.012371453,,0.3035446,1.4285736,98.26788,0.98982173,0.012371453,,,,,,,1,4.7890215,0.20407867,95.0069,0.9510893,0.0017673358,,0.98136365,0.018636364,0.018636364,,strongly positive,it's rare but happens occasionally,,,1,,,,,,,,,,,,,,,,1,,,,,,,,,,,1,,,,,,,,,,,,,,,,,,,,,,,,,,,,,1,conflictul,60 and over,female,university degree,,,,,1,,,,rural area,South,1,,,1,,1,1,,,,Visit workplace winged me. I lived only positive emotions when mau seen children from school.,Among children are always young.,0.19226936,0.6307566,0.43828303,0.64391446,0.7070757,0.6340461,0.8596953,0.67351973,foimoldova2015,SenseMaker New WebCollector; Mozilla/5.0 (Windows NT 6.1; WOW64) AppleWebKit/537.36 (KHTML like Gecko) Chrome/47.0.2526.106 Safari/537.36,,,ro
