9a9ed592-a50b-429f-8858-1c30af06d308,253,2015/12/03 18:06:23.630,2015/12/03 18:05:21.302,01.11.2334,42.244896,46.521698,0.6764415,0.36584082,,6.1299314,88.36734,5.5027246,0.496864,0.76526123,,7.361605,6.326531,86.31187,0.8947513,0.05478777,,43.588966,12.040817,44.370216,0.50390625,0.10427348,,9.732976,41.020405,49.24662,0.69756824,0.3552367,,11.901704,40.204082,47.89421,0.6799626,0.34816736,,8.045696,9.183678,82.77063,0.87362456,0.07953063,,43.2929,11.224487,45.48261,0.5109485,0.09720409,,5.425703,88.36734,6.206953,0.50390625,0.76526123,,6.9462547,86.7347,6.3190475,0.496864,0.7511225,,0.028636336,0.97136366,0.97136366,,strongly negative,it's very common,1,,,,1,,,,,,,,,,,1,,,,,,,,,,,,,1,,,,,,,,,,1,,,1,,,,1,,,,,,,,,,1,,,,,20-24,female,university degree,,,1,,1,1,,,urban area,South,,,1,,,,,,1,ajutor din partea părinților,I was thinking more the situation with stealing billions. Our country is small but things happen if we have a megapolis or an enormous country. Distance from my new power to one man give us half the country participate. It's me îngrijolează situation. You do not know what may happen tomorrow in our country. We as a country we need safe and competent people as president.,Moldova- small country with big problems,0.17176822,0.27220392,0.46106207,0.60115135,0.45422837,0.21299344,0.77769077,0.6899671,foimoldova2015,SenseMaker New WebCollector; Mozilla/5.0 (Windows NT 6.1) AppleWebKit/537.36 (KHTML like Gecko) Chrome/46.0.2490.86 Safari/537.36,,,ro
9f9390e8-aff5-4a8f-80df-ae90229d2af5,254,2015/12/03 19:31:10.407,2015/12/03 19:30:07.831,,,,,,1,88.34752,6.3265314,5.325952,0.08489217,0.05478777,,6.4532943,6.7346954,86.81201,0.9017936,0.05832244,,5.0448475,6.7346954,88.22046,0.91587806,0.05832244,,4.396663,5.9183655,89.68497,0.9264415,0.051253047,,7.3055515,7.1428604,85.55159,0.89123017,0.061857164,,85.734695,5.918366,8.346936,0.11306118,0.051253047,,,,,,,1,7.2135673,5.9183655,86.868065,0.89827245,0.051253047,,9.510207,8.367348,82.12245,0.8630612,0.07246123,,,,,1,negative,it's rare but happens occasionally,,,,,,1,,,,,,,,,,,,1,,,,,,,,,,,,,,,,,,,,,,,,,,1,sănătate,,,,,1,,,,,,,,,,,20-24,male,complete secondary,,1,,,1,,,,urban area,Center,,,1,,,1,,,,,A recent personal experience in my life has been a concern for short action on my health. Increased glucose in my blood was too. I was hospitalized. Throughout the hospital I was terribly worried. Every minute hour day my thought was transferred to this idea.,Anonymous again on hospital beds,,,,,,,,,foimoldova2015,SenseMaker New WebCollector; Mozilla/5.0 (Windows NT 6.1) AppleWebKit/537.36 (KHTML like Gecko) Chrome/46.0.2490.86 Safari/537.36,,,ro
a66a2036-f94a-40e4-9c49-c790704ac914,255,2015/12/21 23:33:04.372,2015/12/21 23:33:01.918,15.636528,17.239578,67.123886,0.7574368,0.14929473,,,,,,,1,6.9370003,7.304352,85.758644,0.8941082,0.06325569,,55.053253,7.652954,37.2938,0.41120276,0.0662746,,5.4491506,43.384903,51.165943,0.728584,0.37571326,,,,,,,1,,,,,,1,51.06045,48.439674,0.49988037,0.24719717,0.41948754,,3.4076757,44.430714,52.16161,0.7437697,0.38476998,,,,,,,1,0.45,0.55,0.55,,strongly negative,it's somewhat common,1,,,1,,,1,,1,,,,,,,,,,,,,,,1,,,,,1,,1,,,,,,,,,,1,,,,,,,,,,,,,,,,1,,,,20-24,male,university degree,,,,,1,,,,urban area,Center,,,1,,,1,,,,,He simtingrijorat political situation in Moldova and especially the leadership instability and its consequences.,Instability in Moldova,0.16590649,0.30656695,0.4436615,0.16476893,0.9336633,0.38517243,0.9127007,0.6394842,foimoldova2015,SenseMaker Android Collector,0.0,0.0,ro
f0c97009-2bdd-4cd7-b4b9-1aaa0fa24d0d,256,2015/12/21 21:49:18.468,2015/12/21 21:49:15.791,40.936176,45.30222,13.7616005,0.36412713,0.39231727,,17.156883,66.7414,16.101717,0.49472415,0.5779805,,15.195696,40.59607,44.208233,0.6450627,0.35156193,,65.20401,18.633995,16.162003,0.25479,0.16137037,,1.4929761,47.04525,51.46178,0.74984396,0.40741184,,1.1219238,48.091064,50.787014,0.7483254,0.41646862,,18.728037,42.339092,38.932873,0.60102415,0.36665654,,41.800835,16.542366,41.6568,0.49927983,0.14325692,,12.101741,36.76142,51.136833,0.69517547,0.3183539,,35.717445,30.835136,33.44742,0.48864987,0.2670323,,0.74,0.26,0.26,,positive,it's rare but happens occasionally,1,1,,,1,,,,,,,,,,,,,,,,,,,,,,1,dorinta  de a schimba ceva in societate.,,,1,,,,1,,,,,,,,1,,,1,,,,,,1,,,1,,,,,,30-34,female,university degree,1,,,,,1,,,urban area,North,1,1,,,,1,,,,,The new mayor in the native village is very active on social networks informed about the activities and actions as the mayor or mayor contributes to a better life in the village. Just mayor knows English and actively participate in different projects of the donor community. He difernite organizes events in the village and not only cultural but also to encourage business. This example gives a breath of encouragement to me and the citizens of the village.,"Be active, encourage your community!",0.19384149,0.82454556,0.40173623,0.8059428,0.59738755,0.81827307,0.8419518,0.8244382,foimoldova2015,SenseMaker Android Collector,0.0,0.0,ro
6a78d526-80ad-4623-906c-6ffe651f2ccc,469,2015/12/21 15:23:39.172,2016/02/11 19:59:43.895,0.18730713,79.11685,20.695843,0.6025427,0.68515193,,1.8284351,52.44862,45.72295,0.7194726,0.45420504,,0.9828366,1.9009856,97.11618,0.9806667,0.016462512,,50.533127,1.2037659,48.2631,0.48864987,0.010424644,,34.25832,33.449677,32.292004,0.49016842,0.28967416,,76.43415,23.468819,0.09702692,0.1166001,0.20363513,,,,,,,1,49.661617,2.9467926,47.391586,0.48864987,0.025519237,,,,,,,1,61.706024,21.074226,17.219748,0.2775686,0.18250278,,0.13999999,0.86,0.86,,strongly negative,it's somewhat common,,1,,,1,,,,,,,,,,,1,,,,,,,,1,,,,,,,,,,,,,,,1,1,,,,,,,1,,1,,,,,,,,,,,,60 and over,female,incomplete secondary,,,,,1,,,,rural area,Center,,,,1,,,1,,,,I work at the market. I have a salary but imiplateste mistress a percentage of any sale. A week from now does not sell anything. sit outside and frost nothing. I do not know what to do anymore. My heart aches . pension is 600 lei.,Don 't sale,0.19647703,0.22487897,0.5013088,0.26495236,0.74936676,0.79052997,,,foimoldova2015,SenseMaker Android Collector,0.0,0.0,ro
13a0b583-5c7b-4da8-9669-6a0cce2f705e,257,2016/01/05 18:20:03.850,2016/01/05 18:20:00.289,0.053466797,51.224495,48.722042,0.7433429,0.4436041,,,,,,,1,0.063530274,99.79592,0.14055176,0.5003851,0.86423266,,0.3035446,1.4285736,98.26788,0.98982173,0.012371453,,0.028435968,98.515366,1.4561977,0.5074274,0.8536285,,0.063530274,99.79592,0.14055176,0.5003851,0.86423266,,,,,,,1,95.634094,0.20407867,4.161825,0.042638645,0.0017673358,,,,,,,1,,,,,,1,0.021363616,0.9786364,0.9786364,,strongly negative,it's rare but happens occasionally,1,,,,,,,,,,,,,,,,,,,,,,1,,,,,,,,,,,,,,1,1,1,,,,,,,1,,,,1,,,,,,,,,,,60 and over,male,university degree,,,,,,1,,,rural area,North,1,,,,,,1,,,,I am very worried which also happens at the moment of the Moldovan government.,Bombo News.,0.19454727,0.34786183,0.44511673,0.13404608,0.8460279,0.14720392,0.82097095,0.67351973,foimoldova2015,SenseMaker New WebCollector; Mozilla/5.0 (Windows NT 6.1; WOW64) AppleWebKit/537.36 (KHTML like Gecko) Chrome/47.0.2526.106 Safari/537.36,,,ro
142e2a0c-2135-4517-904b-b5339ef7e6e0,258,2016/01/05 15:19:24.574,2016/01/05 15:19:21.250,1.073877,49.183674,49.74245,0.7433429,0.4259306,,,,,,,1,59.288883,39.795918,0.9152002,0.2081316,0.34463266,,58.97077,40.980118,0.049105775,0.20461048,0.3552367,,1.172272,98.6727,0.15502566,0.49334288,0.85716325,,0.063530274,99.79592,0.14055176,0.5003851,0.86423266,,97.430595,2.244896,0.32451493,0.01446963,0.019440796,,1.6401318,97.34695,1.0129248,0.496864,0.8430245,,,,,,,1,,,,,,1,0.0031818151,0.9968182,0.9968182,,negative,it's somewhat common,,,,,1,,,,,,,,,,,1,,,,,,1,,,,,,,,1,,,,,,,1,1,1,,,,1,,,,,,,1,,,,,,,,,,,35-39,female,university degree,1,,,,1,1,,,urban area,Center,1,,,,,1,,,,,Recently I was a member of the headquarters parents in court. education which was announced about accumulations money for the repair room where children spend part of the day to purchase real estate.,State involvement in the education of young generation.,,,,,,,,,foimoldova2015,SenseMaker New WebCollector; Mozilla/5.0 (Windows NT 6.1; WOW64) AppleWebKit/537.36 (KHTML like Gecko) Chrome/47.0.2526.106 Safari/537.36,,,ro
292c7f89-47a7-42ca-a4af-64c75e1b97c1,259,2016/01/05 18:08:44.745,2016/01/05 18:08:41.189,2.252378,96.12245,1.625171,0.496864,0.8324204,,33.94108,32.040817,34.0181,0.5003851,0.27747348,,32.568558,34.081635,33.349808,0.50390625,0.29514694,,48.542973,1.4285736,50.02845,0.5074274,0.012371453,,0.043415222,2.653061,97.30353,0.9863006,0.02297552,,0.80368185,1.8367386,97.35958,0.9827795,0.015906125,,33.1808,32.85715,33.96205,0.50390625,0.28454286,,33.384888,32.448975,34.166138,0.50390625,0.28100815,,33.737,32.448975,33.814026,0.5003851,0.28100815,,34.03306,33.265305,32.701637,0.49334288,0.28807753,,0.9886364,0.011363637,0.011363637,,positive,it's rare but happens occasionally,1,,,,,,,,1,,,,,,,,,,,,,,,1,,,,,,,,,,1,,,,,,,,,1,,,1,,,1,,,1,,,,,,,,,55-59,female,complete technical/vocational,,,,1,,,,,rural area,North,1,1,,,,1,,,,,Recently held community Communal Council and discussed various issues that have worried as well and made us feel encouraged to discuss issues such as citidiene citizens from the village.,Precautarea applications condoliantelor citizens.,0.16721241,0.6537829,0.14443336,0.8018092,0.8551395,0.24588817,0.7685792,0.71957237,foimoldova2015,SenseMaker New WebCollector; Mozilla/5.0 (Windows NT 6.1; WOW64) AppleWebKit/537.36 (KHTML like Gecko) Chrome/47.0.2526.106 Safari/537.36,,,ro
2f8c0b34-6615-42a4-8b8f-cfa46a390d40,260,2016/01/05 16:43:00.962,2016/01/05 16:42:57.517,16.727802,26.32653,56.945663,0.7010893,0.22798777,,,,,,,1,49.395233,1.8367386,48.76803,0.496864,0.015906125,,74.00288,7.551018,18.446102,0.22221611,0.06539184,,34.089115,32.448975,33.46191,0.496864,0.28100815,,,,,,,1,7.805704,7.551018,84.64328,0.88418794,0.06539184,,47.91061,5.510208,46.579185,0.49334288,0.047718376,,,,,,,1,47.206387,5.510208,47.28341,0.5003851,0.047718376,,0.82863635,0.17136364,0.17136364,,negative,it's somewhat common,1,1,1,1,1,,,,,,,,,,,1,,,,,,,,1,,,,,,1,1,,,,1,,,,1,1,,,,,,1,,,,1,1,,,,,,,1,,,25-29,female,postgraduate masters,,1,,,,,,,urban area,Center,,,,,1,1,,,,,Miccresterea continue to pay prices for all products discourages me to see myself in the future living in Moldova. With suflrtul want to remain in the country for people who live here dear to me material would not want to run away cit.,Studies over hotarezero appreciation in the country.,0.17176822,0.2524671,0.4177819,0.68667763,0.20593679,0.6833881,0.8391942,0.6965461,foimoldova2015,SenseMaker New WebCollector; Mozilla/5.0 (Windows NT 6.1; WOW64) AppleWebKit/537.36 (KHTML like Gecko) Chrome/47.0.2526.106 Safari/537.36,,,ro
3d07e6cd-b97d-4d9b-b0b2-69a3657feda1,261,2016/01/05 15:25:30.984,2016/01/05 15:25:27.648,1.2664539,36.122448,62.61109,0.8067232,0.3128204,,,,,,,1,0.028435968,98.515366,1.4561977,0.5074274,0.8536285,,0.22305605,12.857146,86.9198,0.9334837,0.11134288,,2.6044874,96.12245,1.2730615,0.49334288,0.8324204,,0.5191174,13.67347,85.80741,0.9264415,0.11841222,,0.13107239,11.632652,88.236275,0.94052595,0.10073876,,1.2880175,97.34695,1.365039,0.5003851,0.8430245,,0.110950924,14.489792,85.39926,0.9264415,0.12548162,,87.39898,12.4489765,0.15205324,0.06376541,0.10780815,,0.021363616,0.9786364,0.9786364,,strongly negative,it's rare but happens occasionally,,1,,1,1,,,,,,,1,,,,1,,,,,,1,,1,,,,,1,,1,,,,,,1,,1,,,1,,,,,,,,,1,,,,1,,,,,,55-59,female,university degree,,1,,,1,1,,,urban area,Center,1,1,,,,1,,,,,Shares of protesters in downtown Chisinau. In the context of events in the region worries me very much.,Protests in Chisinau.,0.15354499,0.27549344,0.41322607,0.25575656,0.107986905,0.27220392,0.7412443,0.16694081,foimoldova2015,SenseMaker New WebCollector; Mozilla/5.0 (Windows NT 6.1; WOW64) AppleWebKit/537.36 (KHTML like Gecko) Chrome/47.0.2526.106 Safari/537.36,,,ro
4028de5b-b0a2-4208-8ff6-158584e130dd,262,2016/01/05 15:57:04.854,2016/01/05 15:57:01.476,28.494114,62.653057,8.852824,0.40179357,0.54257554,,0.17586364,97.81801,2.006132,0.5109485,0.8500939,,13.393511,56.938778,29.667711,0.581371,0.49308982,,38.987072,22.65306,38.359867,0.496864,0.19617552,,18.975576,50.0,31.024424,0.56024426,0.433,,16.479164,40.204082,43.316753,0.63418794,0.34816736,,45.313602,10.0,44.686398,0.496864,0.08660002,,32.364475,34.4898,33.145725,0.50390625,0.29868165,,,,,,,1,31.341204,8.367348,60.29146,0.6447513,0.07246123,,0.27590907,0.72409093,0.72409093,,negative,it's somewhat common,1,,,,,,,,,,,,,,,1,,1,,1,,1,1,1,,1,,,1,,1,,1,1,1,,1,,,,,1,,,,1,,,,1,,1,,,,,,,,,25-29,female,postgraduate masters,,1,,,1,,,,urban area,Center,,,1,,,1,,,,,Political and economic situation in the country led to the organization of protests from the population. Inability conditional on why more people are forced to change unwillingness to continue the protest more than a month. Additional teams that this protest aimed to ponegriimaginea opponents resort to despicable actions which have an impact over the population.,Protests continue more than 1 month.,0.1581008,0.31825656,0.39955866,0.265625,0.65923977,0.265625,0.8574174,0.19325656,foimoldova2015,SenseMaker New WebCollector; Mozilla/5.0 (Windows NT 6.1; WOW64) AppleWebKit/537.36 (KHTML like Gecko) Chrome/47.0.2526.106 Safari/537.36,,,ro
4682f941-2fcf-4920-87e9-f1e57b4238d3,263,2016/01/05 16:06:38.764,2016/01/05 16:06:35.385,1.4259961,49.183674,49.39033,0.73982173,0.4259306,,2.7525244,96.5306,0.7168701,0.48982173,0.8359551,,50.21156,0.20407867,49.584354,0.496864,0.0017673358,,49.859447,0.20407867,49.93647,0.5003851,0.0017673358,,0.033347167,54.08164,45.88502,0.72925836,0.46834692,,1.2219117,49.591843,49.18625,0.73982173,0.42946532,,98.09888,0.20407864,1.6970363,0.017990757,0.0017673358,,0.16556396,49.591843,50.242596,0.7503851,0.42946532,,,,,,,1,50.563667,0.20407867,49.232246,0.49334288,0.0017673358,,0.8577273,0.14227273,0.14227273,,positive,it's rare but happens occasionally,1,1,1,1,1,,,,,,,,,,,1,,1,,,,,,,,1,,,1,,1,,,,,,1,,1,,1,1,,,,,,,,1,,,,,,,,,,,55-59,female,postgraduate masters,1,1,,,1,1,,,urban area,Center,1,,,,,1,,,,,Recently I was encouraged by tenth of thousands of citizens who over four days in Dmana came to protest.,TARA Awake!,0.8278047,0.7919408,,,,,,,foimoldova2015,SenseMaker New WebCollector; Mozilla/5.0 (Windows NT 6.1; WOW64) AppleWebKit/537.36 (KHTML like Gecko) Chrome/47.0.2526.106 Safari/537.36,,,ro
48480fc7-c0d3-4c88-9f14-aa4d2bbf05e9,264,2016/01/05 17:35:10.046,2016/01/05 17:35:06.539,37.7827,22.244902,39.972397,0.5109485,0.19264084,,16.012077,13.67347,70.31445,0.7715119,0.11841222,,7.4535856,7.551018,84.9954,0.8877091,0.06539184,,94.40961,2.653061,2.937334,0.042638645,0.02297552,,0.8798535,98.16327,0.95687497,0.5003851,0.8500939,,15.751937,14.897956,69.3501,0.76799077,0.12901634,,1.620008,0.20407867,98.1759,0.9827795,0.0017673358,,15.629784,67.95918,16.411034,0.50390625,0.58852655,,17.104342,15.714288,67.18137,0.7503851,0.13608573,,,,,,,1,0.09409094,0.90590906,0.90590906,,negative,it's somewhat common,,,1,,1,,,,,,,,,,,,,,,,,,,,,,1,nu stiu cum a fost stabilit costul final al trecerii de pietoni si care persoane au fost influentate.,1,,1,,,,,,1,1,,,,,,,,,,,,,,,,,,,,,1,securitatea personala,20-24,female,university degree,,1,,,1,1,,,urban area,Center,1,,,,,,,,1,Salariul sotului,"Street Albisoara no crosswalk at intersctiile route. I asked the authorities to install such a route when we moved in and noticed that region is absolutely virtually impossible to cross the street because the flow of cars. Authorities solved the problem installed two signs after two months. At my request was repeated over 2 weeks drawing and marking. Costs were declared 60,000 lei.","Zebra 60,000 law !!!",0.725299,0.18667763,0.7435222,0.23601973,0.91208714,0.3050987,0.7321327,0.80509865,foimoldova2015,SenseMaker New WebCollector; Mozilla/5.0 (Windows NT 6.1; WOW64) AppleWebKit/537.36 (KHTML like Gecko) Chrome/47.0.2526.106 Safari/537.36,,,ro
5eff8e9d-e6f6-4e28-8fa7-38272f14325b,265,2016/01/05 15:02:26.571,2016/01/05 15:02:23.270,6.934758,74.081635,18.983606,0.56024426,0.64154696,,48.00259,6.7346954,45.262714,0.48630062,0.05832244,,53.780113,14.897956,31.321928,0.38770908,0.12901634,,73.96695,5.510208,20.522844,0.23277949,0.047718376,,11.04082,55.306126,33.653057,0.6130612,0.47895104,,1.3440722,96.5306,2.1253223,0.50390625,0.8359551,,48.20667,6.326531,45.466797,0.48630062,0.05478777,,69.89681,26.32653,3.7766554,0.1693992,0.22798777,,33.82898,33.67347,32.497555,0.49334288,0.29161227,,1.0508838,23.877548,75.07156,0.8701034,0.20677957,,0.4759091,0.5240909,0.5240909,,negative,it's very common,1,,,,,,,,,,,,,,,,,,,,,,,,,,1,ei insusi,1,,1,,1,1,1,,1,1,1,1,,1,,,,1,,,,,,1,,,,,,,,,25-29,male,postgraduate masters,,1,,,,,,,urban area,Center,,,,1,,1,,,,,Disclosures related to the functioning of state institutions and the activities of officials and elected representatives of the people.,R.M-state corruption.,0.8300826,0.23601973,0.68429667,0.28207237,0.7913582,0.3643092,0.77541286,0.70641446,foimoldova2015,SenseMaker New WebCollector; Mozilla/5.0 (Windows NT 6.1; WOW64) AppleWebKit/537.36 (KHTML like Gecko) Chrome/47.0.2526.106 Safari/537.36,,,ro
700053bf-5861-489b-a112-1d0802b2c14e,266,2016/01/05 14:46:44.292,2016/01/05 14:46:41.138,,,,,,1,6.1126766,19.387756,74.49957,0.84193444,0.16789798,,16.70049,8.775505,74.523994,0.7891175,0.0759959,,5.8051205,5.9183655,88.27651,0.912357,0.051253047,,91.07244,5.1020355,3.8255227,0.06376541,0.044183653,,1.4921045,96.938774,1.569126,0.5003851,0.8394898,,,,,,,1,86.939064,6.326531,6.7344017,0.09897667,0.05478777,,,,,,,1,,,,,,1,,,,1,neutral,it's a one-time occurrence,,,,,1,,1,,,,,,,,,,,,,,,,,,,,,,1,,,,,,,1,,,1,1,,,,,,,,,,,,,,,,,,,1,indeferenta oamenilor,under 17,male,postgraduate masters,1,1,,,1,1,,,urban area,Center,,,1,,,1,,,,,In spring 2003 after a fire I have been made homeless. It was an old apartment building. Most interesting was the indifference of all state (nothing inplicare) societatiirudelor ...,Nothing interesting.,0.17860194,0.2886513,0.48611903,0.7162829,0.4792853,0.7129934,0.44283885,0.68667763,foimoldova2015,SenseMaker New WebCollector; Mozilla/5.0 (Windows NT 6.1; WOW64) AppleWebKit/537.36 (KHTML like Gecko) Chrome/47.0.2526.106 Safari/537.36,,,ro
7d1a135a-9164-4cb4-98b5-8b83499edeb5,267,2016/01/05 17:43:00.319,2016/01/05 17:42:56.786,7.4464016,87.14285,5.410747,0.48982173,0.75465715,,2.1963282,96.938774,0.8649023,0.49334288,0.8394898,,29.451286,41.020405,29.528309,0.5003851,0.3552367,,46.890205,7.551018,45.55878,0.49334288,0.06539184,,30.211561,40.204082,29.584354,0.496864,0.34816736,,,,,,,1,,,,,,1,81.72492,18.163261,0.111811526,0.09193442,0.15729387,,,,,,,1,0.028435968,98.515366,1.4561977,0.5074274,0.8536285,,,,,1,negative,it's somewhat common,,1,,1,1,,,,,,,,,,,1,,,,,,1,,1,,,,,1,,,,,,1,,,1,,,1,,,,,1,,,,,1,,,,,,,,,,30-34,female,postgraduate masters,,1,,,1,1,,,urban area,Center,,,,,1,1,,,,,Recently a criminal case was initiated against members organizatieei the asset. This worried us because both freedom and safety of the members is in danger as well as our services benificiarilor suffers because we can not go on the left bank.,Human rights defenders at risk.,0.20821469,0.37417763,0.18543565,0.27549344,0.20593679,0.9037829,0.082929954,0.8083882,foimoldova2015,SenseMaker New WebCollector; Mozilla/5.0 (Windows NT 6.1; WOW64) AppleWebKit/537.36 (KHTML like Gecko) Chrome/47.0.2526.106 Safari/537.36,,,ro
7d5ea281-6a5a-44de-b6f1-66cc8279834f,268,2016/01/05 18:30:08.214,2016/01/05 18:30:04.619,0.017539062,49.183674,50.79879,0.75390625,0.4259306,,97.838745,1.4285736,0.7326761,0.01446963,0.012371453,,0.028435968,98.515366,1.4561977,0.5074274,0.8536285,,0.053466797,51.224495,48.722042,0.7433429,0.4436041,,34.349243,31.224485,34.426266,0.5003851,0.27040407,,,,,,,1,,,,,,1,32.772644,33.67347,33.553894,0.50390625,0.29161227,,,,,,,1,0.47169435,98.97959,0.54871583,0.5003851,0.85716325,,,,,1,strongly negative,it's very common,1,,1,,1,,,,,,,1,,,,,,1,,1,,,,,,,,,,1,,1,,,,,,1,,,,,,,,1,,1,,,,,,,1,,,,,,60 and over,female,university degree,,,,1,,,,,rural area,North,1,,,,,,1,,,,I recently heard a case so a young teacher makes a student observation headset with high-mara mouth saying he would swallow with all the boots in which the student responds ..- If I do not eat meat you oaie.Sincer Super shocked me say student attitudes toward teachers. This is called democratic education? It's not violating the dignity teacher? The teacher can not raped but student?,Where da crack and where?,0.22416002,0.25904608,0.4770074,0.28536183,0.8141372,0.203125,,,foimoldova2015,SenseMaker New WebCollector; Mozilla/5.0 (Windows NT 6.1; WOW64) AppleWebKit/537.36 (KHTML like Gecko) Chrome/47.0.2526.106 Safari/537.36,,,ro
7fd4dd44-6e6c-493a-b52e-72de2ba915e0,269,2016/01/05 18:15:26.412,2016/01/05 18:15:22.843,0.054257464,45.053097,54.892643,0.775033,0.3905837,,0.17562501,98.16327,1.6611036,0.5074274,0.8500939,,98.09888,0.20407864,1.6970363,0.017990757,0.0017673358,,0.063530274,99.79592,0.14055176,0.5003851,0.86423266,,0.0155127635,75.28276,24.701729,0.62362456,0.65215105,,49.303253,0.61224365,50.084503,0.50390625,0.005302059,,,,,,,1,29.676924,1.8367386,68.486336,0.6940471,0.015906125,,,,,,,1,39.296066,0.20407867,60.499847,0.6060189,0.0017673358,,0.032272756,0.96772724,0.96772724,,strongly negative,it's very common,,1,,,1,,,,1,1,,,,,,1,,,,,,,,,,,,,,1,,,,,,,,1,1,,,,,,,,,1,1,1,,,,,,,,,,,60 and over,female,university degree,,,,,,1,,,rural area,North,1,,,,,,1,,,,We are in the village where people Melons should be inherited from ancestors and descendants transmitted. But often remain out everything we want to be present and to our descendants shall inherit all traditions.,Let's not forget what has been created by our precesorii.,0.18087985,0.24917763,0.49750856,0.26891446,0.77541286,0.6768092,,,foimoldova2015,SenseMaker New WebCollector; Mozilla/5.0 (Windows NT 6.1; WOW64) AppleWebKit/537.36 (KHTML like Gecko) Chrome/47.0.2526.106 Safari/537.36,,,ro
80d2b74e-cc60-48de-8040-7fc8fb10367a,270,2016/01/05 16:57:11.809,2016/01/05 16:57:08.342,29.382303,65.102036,5.5156612,0.38066682,0.56378365,,44.96005,45.91837,9.12158,0.32080767,0.39765307,,33.32884,33.265305,33.405857,0.5003851,0.28807753,,0.5277392,98.16327,1.3089893,0.50390625,0.8500939,,0.56367016,0.20407867,99.23225,0.9933429,0.0017673358,,7.1144047,84.28571,8.599882,0.5074274,0.72991425,,8.453869,8.367348,83.17879,0.87362456,0.07246123,,8.862033,7.551018,83.58695,0.87362456,0.06539184,,2.252378,96.12245,1.625171,0.496864,0.8324204,,0.17562501,98.16327,1.6611036,0.5074274,0.8500939,,0.77772725,0.22227272,0.22227272,,strongly positive,it's rare but happens occasionally,1,,,,,,,,1,,,1,,,,,,,,1,,1,,,,1,,,,1,,,,,,1,,,,,,1,,,,1,,,,,,,,,,,,,,,25-29,female,postgraduate masters,,1,,,1,,,,urban area,Center,1,1,,,,1,,,,,Fair NGOs that I attended as a participant and organizer of the volunteer team that did the winged p / n to move forward in my work.,Young people participating in social initiative !!!,0.8027477,0.74917763,0.77313495,0.6307566,0.14215547,0.72615135,0.43372723,0.703125,foimoldova2015,SenseMaker New WebCollector; Mozilla/5.0 (Windows NT 6.1; WOW64) AppleWebKit/537.36 (KHTML like Gecko) Chrome/47.0.2526.106 Safari/537.36,,,ro
82a0644b-0cbc-465b-bda7-373d3c36af3b,271,2016/01/05 17:17:10.143,2016/01/05 17:17:06.861,34.089115,32.448975,33.46191,0.496864,0.28100815,,49.961483,50.0,0.038513184,0.25038514,0.433,,0.31503603,14.0816345,85.60333,0.9264415,0.121946946,,55.63553,44.285713,0.07875489,0.22221611,0.38351429,,0.074330255,47.887886,52.037777,0.7609485,0.41532654,,0.4817578,47.551014,51.967228,0.7574274,0.4117918,,,,,,,1,33.97701,34.081635,31.941355,0.48982173,0.29514694,,0.9359033,97.34695,1.7171534,0.50390625,0.8430245,,0.58378905,97.34695,2.0692677,0.5074274,0.8430245,,0.9959091,0.004090909,0.004090909,,strongly negative,it's very common,1,1,1,,1,,,,1,,,,,,1,,,1,1,,,,,,,,,,1,1,1,,,1,,,1,1,1,,,,,,,1,,,,1,,,,,1,1,,,,,20-24,female,university degree,,1,,,1,1,,,urban area,Center,,,1,,,,,,1,sursele parintilor,I want to get driving license autourmeaza to the exam theoretical / practical DITCCA CIATS REGISTRY. Among my friends there were those who took their license experianta telling my situation worries me. The reason <corruption examine the practical exam. Two weeks ago friend (friend) I have asked my 800 euros p / t getting to class B and C that he refused to pay bribes and got out. Unalt same school colleague who obsolvit auto p / n categories B and C and were asked 600 euro refuzindrespectiv it will go to the exam repeatedly. I am now in a position to be neficienta method axaminarii and shamelessness inequality actions of those responsible.,Corruption and CRIS DTTCA examiners to register.,0.18087985,0.19983554,0.1603787,0.17023027,0.057873007,0.7294408,0.18087985,0.8347039,foimoldova2015,SenseMaker New WebCollector; Mozilla/5.0 (Windows NT 6.1; WOW64) AppleWebKit/537.36 (KHTML like Gecko) Chrome/47.0.2526.106 Safari/537.36,,,ro
