9c7a4387-79b8-4b7d-a8bd-7ef9467cebbe,74,2016/01/25 20:18:51.564,2016/01/25 20:18:24.696,4.3046927,4.693878,91.00143,0.9334837,0.040648982,,3.6004643,4.693878,91.70566,0.94052595,0.040648982,,6.325379,3.4693909,90.20522,0.9193992,0.030044915,,01.04.9888,7.551018,87.46018,0.912357,0.06539184,,6.1299314,88.36734,5.5027246,0.496864,0.76526123,,4.360737,3.8775482,91.76172,0.93700486,0.033579584,,5.9818993,87.95918,6.058921,0.5003851,0.7617265,,87.29118,6.3265314,6.3822894,0.09545554,0.05478777,,89.81202,5.510208,4.677775,0.07432879,0.047718376,,5.9818993,87.95918,6.058921,0.5003851,0.7617265,,,,,1,negative,it's somewhat common,1,,,,,,,,,,,,,1,,,,,,,,,,,,,,,1,,,,,,,,,,,,,,,1,,,,,,,,,,,,,,,1,здоровье,20-24,female,some university (no degree),,,1,,1,,,,urban area,Transnistria,,,1,,,1,,,,,"In 2013, I lay in the hospital for long-term treatment. We in the House were peeled off wallpaper and plaster fell. At that time the House was 3 people including 2 elderly women and one young girl. At our request tidy responded immediately but began to do so without asking us to leave the room. The Chamber raised dust was stifling wallpaper pasted it was impossible to breathe with us. No one took care of our relocation",The negligent attitude to patients,0.13341619,0.84457237,,,,,,,foimoldova2015,SenseMaker New WebCollector; Mozilla/5.0 (Windows NT 6.3; WOW64) AppleWebKit/537.36 (KHTML like Gecko) Chrome/47.0.2526.111 Safari/537.36,,,ru
a7f850ad-6dfd-41f5-8429-2eb1a182a55f,75,2016/01/25 21:39:51.355,2016/01/25 21:39:23.870,,,,,,1,7.4521437,43.469383,49.078472,0.7081316,0.3764449,,,,,,,1,87.64329,6.3265314,6.0301776,0.09193442,0.05478777,,5.71314,4.693878,89.59298,0.9193992,0.040648982,,,,,,,1,42.03248,11.632652,46.33486,0.5215119,0.10073876,,5.017539,89.18367,5.798789,0.50390625,0.77233064,,7.0655437,5.510208,87.42425,0.9017936,0.047718376,,5.165571,89.591835,5.242593,0.5003851,0.7758653,,,,,1,positive,it's a one-time occurrence,1,,,,,,,,,,,,,,,1,,,,,,1,,1,,,,,,,1,,,,,,,,,,,,,,,,,,,1,,,,,,,,,,,25-29,female,some university (no degree),,,,,1,,,,urban area,Transnistria,,1,,,,1,,,,,The change of power Elections BC Deputies,Changes in the legislative branch,,,,,,,,,foimoldova2015,SenseMaker New WebCollector; Mozilla/5.0 (Windows NT 6.3; WOW64) AppleWebKit/537.36 (KHTML like Gecko) Chrome/47.0.2526.111 Safari/537.36,,,ru
bcda104a-9371-4676-afd7-76af9486514d,76,2016/01/25 20:25:36.821,2016/01/25 20:25:09.813,5.0089116,4.693878,90.2972,0.9264415,0.040648982,,,,,,,1,5.657096,5.510208,88.832695,0.91587806,0.047718376,,,,,,,1,5.3136034,90.0,4.6863966,0.496864,0.7794,,86.73498,6.7346954,6.5303197,0.09897667,0.05832244,,5.9258494,88.77551,5.2986426,0.496864,0.7687959,,7.7697716,5.510208,86.72002,0.8947513,0.047718376,,,,,,,1,88.81173,4.6938777,6.4943886,0.08841329,0.040648982,,,,,1,negative,it's very common,,,,,1,,,,1,,,,,,,1,,,,,,,,,,,,,,,1,,,,,,1,,,,,,,,,1,,,,,,,,,,,,1,,,30-34,female,complete secondary,,,,,,1,,,urban area,Transnistria,,1,,,,1,,,,,The situation in Transnistria as a result of which the administration has decided to hold the funds from salaries and pensions,What happened? How to get out of the situation?,0.37887073,0.7853618,0.5129616,0.7722039,0.7311435,0.72615135,0.8834162,0.7097039,foimoldova2015,SenseMaker New WebCollector; Mozilla/5.0 (Windows NT 6.3; WOW64) AppleWebKit/537.36 (KHTML like Gecko) Chrome/47.0.2526.111 Safari/537.36,,,ru
c2e52df7-ede9-4abf-b1b3-b3b472d1a205,77,2016/01/25 19:54:35.791,2016/01/25 19:54:09.026,33.737,32.448975,33.814026,0.5003851,0.28100815,,5.1095214,90.408165,4.4823146,0.496864,0.7829347,,6.0652595,4.693878,89.24086,0.91587806,0.040648982,,88.64358,7.1428604,4.2135606,0.07784991,0.061857164,,5.3136034,90.0,4.6863966,0.496864,0.7794,,88.05145,5.510208,6.4383388,0.09193442,0.047718376,,5.9258494,88.77551,5.2986426,0.496864,0.7687959,,89.25582,5.9183655,4.825808,0.07784991,0.051253047,,33.124756,33.67347,33.20178,0.5003851,0.29161227,,64.63956,15.714288,19.646158,0.275033,0.13608573,,0.5304545,0.46954545,0.46954545,,strongly negative,it's somewhat common,1,,,,1,,,,1,,,,,,,,,1,,,,1,1,,,,,,,,1,,,,,,,,1,,,1,,,,,,,,,,,,,1,,,,,,25-29,female,university degree,,,,,1,,,,urban area,Transnistria,1,,,,,1,,,,,"Due to lack of funds in the state for pensions. Recently, a large number of senior citizens who ask for money to buy food. Or specific products",Power brings old,0.18796165,0.26891446,0.77659804,0.21299344,0.4334162,0.203125,0.39932528,0.33470392,foimoldova2015,SenseMaker New WebCollector; Mozilla/5.0 (Windows NT 6.3; WOW64) AppleWebKit/537.36 (KHTML like Gecko) Chrome/47.0.2526.111 Safari/537.36,,,ru
d73d23f7-0c31-423d-a5ea-ff455d96f0e4,78,2016/01/25 21:28:13.864,2016/01/25 21:27:46.721,,,,,,1,,,,,,1,3.952574,4.693878,91.353546,0.93700486,0.040648982,,88.05145,5.510208,6.4383388,0.09193442,0.047718376,,44.497276,11.632652,43.870068,0.496864,0.10073876,,87.90343,5.1020355,6.994536,0.09545554,0.044183653,,89.199776,6.734696,4.0655317,0.07432879,0.05832244,,86.32683,7.551018,6.122158,0.09897667,0.06539184,,87.29118,6.3265314,6.3822894,0.09545554,0.05478777,,85.21444,8.367348,6.4182186,0.10601892,0.07246123,,,,,1,strongly negative,it's very common,,,,,1,,,,,1,,,,,,,,,,,,,,,,,,,1,,,,,,,,,,,,,,,,,1,,,,1,,,,,,,,,,,25-29,male,postgraduate other,1,,,,,,,,rural area,Transnistria,1,,,,,1,,,,,The road is bad and clean the road by bus do not go all the time with a delay. I live in Spee they clean up steers very well and are always on the roads clogged with snowdrifts.,Poor performance of road services,0.0675071,0.6932566,0.18341619,0.8643092,0.14477983,0.19325656,0.80614346,0.6274671,foimoldova2015,SenseMaker New WebCollector; Mozilla/5.0 (Windows NT 6.3; WOW64) AppleWebKit/537.36 (KHTML like Gecko) Chrome/47.0.2526.111 Safari/537.36,,,ru
dcad1549-efd5-424a-a176-b87a1307b840,79,2016/01/25 19:58:11.253,2016/01/25 19:57:44.478,1.3699415,50.0,48.63006,0.7363006,0.433,,20.112396,38.57143,41.316174,0.6060189,0.33402857,,28.051456,25.5102,46.43834,0.59193444,0.22091836,,33.532913,32.85715,33.609936,0.5003851,0.28454286,,33.532913,32.85715,33.609936,0.5003851,0.28454286,,0.27767333,47.959183,51.763145,0.7574274,0.41532654,,39.27882,31.224485,29.49669,0.45108935,0.27040407,,53.634953,42.653065,3.7119825,0.25038514,0.3693755,,54.00719,39.795918,6.1968923,0.2609485,0.34463266,,6.543835,43.877556,49.578613,0.71517384,0.3799796,,0.43227273,0.56772727,0.56772727,,negative,it's somewhat common,,,,1,,,,,,,,,,,,,1,,,,,,,,,,,,,,,,,,,,,1,,,,,,,,,,,,,,,,,1,,,,,,25-29,female,university degree,1,,,,,,,,urban area,Transnistria,1,,,,,1,,,,,I was thrilled poor picture before the new year of their huge number and the indifference of passing.,indifference,,,,,,,,,foimoldova2015,SenseMaker New WebCollector; Mozilla/5.0 (Windows NT 6.3; WOW64) AppleWebKit/537.36 (KHTML like Gecko) Chrome/47.0.2526.111 Safari/537.36,,,ru
dfe0e78c-5dc9-4ec1-90a0-ecaac929f116,80,2016/01/25 21:52:08.509,2016/01/25 21:51:41.284,15.251805,14.489792,70.2584,0.775033,0.12548162,,17.114405,64.28571,18.599882,0.5074274,0.5567143,,11.048008,75.71429,13.237704,0.5109485,0.6556857,,14.047434,14.0816345,71.87093,0.7891175,0.121946946,,13.384883,72.44899,14.166133,0.50390625,0.62740815,,,,,,,1,13.032768,72.44899,14.518248,0.5074274,0.62740815,,73.51854,12.040817,14.4406395,0.20461048,0.10427348,,14.731535,16.938774,68.3297,0.76799077,0.1466898,,71.58983,14.489792,13.920374,0.21165273,0.12548162,,0.0831818,0.9168182,0.9168182,,negative,it's very common,1,,,,,,1,,,,,,1,,1,,,,,,,1,,,,,,,1,,,1,,,1,,1,,1,,,,1,,,,,,,1,,,,,1,1,,,,,17-19,female,some university (no degree),,,,,1,,,,urban area,Transnistria,,,,1,,1,,,,,"Repeatedly we have to see how teenagers and young people walk around the streets making myself obscene speech did not hesitate and did not understand the fact that it affects the most is not the best way for them, and perhaps to others. It is appalling that the hungry animals walk on the street and some violent teenagers beat them instead of helping.",People and animals-urgent vorpos,,,,,,,,,foimoldova2015,SenseMaker New WebCollector; Mozilla/5.0 (Windows NT 6.3; WOW64) AppleWebKit/537.36 (KHTML like Gecko) Chrome/47.0.2526.111 Safari/537.36,,,ru
e79269cd-4161-48a2-a61a-c25efea7c102,81,2016/01/25 20:49:58.105,2016/01/25 20:49:31.114,7.3055515,7.1428604,85.55159,0.89123017,0.061857164,,4.461343,89.591835,5.946821,0.5074274,0.7758653,,3.396389,5.1020355,91.50158,0.94052595,0.044183653,,4.044564,5.9183655,90.03707,0.9299626,0.051253047,,4.4972754,91.63266,3.8700686,0.496864,0.79353875,,5.897094,7.1428604,86.960045,0.9053147,0.061857164,,5.369653,89.18367,5.446675,0.5003851,0.77233064,,84.41823,7.1428604,8.438912,0.120103434,0.061857164,,5.9258494,88.77551,5.2986426,0.496864,0.7687959,,86.58695,6.326531,7.0865145,0.1024978,0.05478777,,0.0068181753,0.9931818,0.9931818,,strongly positive,it's very common,,,1,,,,,,,,,,,,,,,,,,,,,,,,1,инвалид,,,,,,,,,,,,,,,1,,,,,,,1,,,,,,,,,,,20-24,male,complete secondary,,,1,,,,,,urban area,Transnistria,,,1,,,1,,,,,"The last time I saw a man in a wheelchair to help him get up to the second floor in his apartment because he asked me to. And we met talked with him. He was a wise man. He said that should never laugh at someone needed help to do good not to be selfish. Then we say goodbye, I went home and began to think over his words. And I tried to be like him.",There are still good people in the world,0.18568893,0.79523027,0.8470526,0.73601973,0.09705256,0.68667763,0.15387073,0.21299344,foimoldova2015,SenseMaker New WebCollector; Mozilla/5.0 (Windows NT 6.3; WOW64) AppleWebKit/537.36 (KHTML like Gecko) Chrome/47.0.2526.111 Safari/537.36,,,ru
0c8e300c-dafd-4064-8df0-15e59fcf95ac,82,2015/12/03 19:16:39.900,2015/12/03 19:15:36.195,34.589252,32.85715,32.553596,0.48982173,0.28454286,,21.364187,53.67347,24.962341,0.51799077,0.46481225,,18.936766,19.795921,61.267315,0.71165276,0.17143266,,21.529474,23.061218,55.409306,0.6693992,0.19971018,,21.901707,20.204077,57.89421,0.6799626,0.17496732,,21.049442,19.795921,59.15464,0.69052595,0.17143266,,43.524284,28.36735,28.108362,0.42292035,0.24566121,,22.93792,23.061218,54.000862,0.6553147,0.19971018,,54.296066,20.204077,25.499853,0.35601893,0.17496732,,57.000877,21.836731,21.162397,0.32080767,0.1891061,,0.4940909,0.5059091,0.5059091,,positive,it's rare but happens occasionally,,,1,,,,,,,,,,,,,,,1,,,,,,,,,,,,,,,,,1,,,,,,,,,,,1,,,,,,,,,,,,,,,17-19,female,complete secondary,1,,,,,,,,rural area,Center,,,1,,,1,,,,,Garbage collection in the river which is a tributary through my community. People were very receptive to this action.,It is what remains after,,,,,,,,,foimoldova2015,SenseMaker New WebCollector; Mozilla/5.0 (Windows NT 6.3; WOW64) AppleWebKit/537.36 (KHTML like Gecko) Chrome/48.0.2564.22 Safari/537.36,,,ro
26c57196-a5f7-4e7b-af59-ba3efd40f34e,83,2015/12/03 17:56:14.005,2015/12/03 17:55:10.592,4.8192043,45.91837,49.262424,0.7222161,0.39765307,,5.4314528,44.69387,49.87468,0.7222161,0.38704896,,81.67318,11.224487,7.1023254,0.1271457,0.09720409,,8.755681,65.51021,25.734108,0.58489215,0.5673183,,5.3754005,45.510204,49.114395,0.718695,0.39411834,,8.629203,26.32653,65.04426,0.7820753,0.22798777,,30.39983,34.897957,34.702213,0.5215119,0.30221632,,4.595,49.183674,46.22133,0.7081316,0.4259306,,4.41104,46.734695,48.854263,0.7222161,0.40472248,,5.651343,49.183674,45.164986,0.69756824,0.4259306,,0.9959091,0.004090909,0.004090909,,positive,it's somewhat common,,,1,,,,1,,,,,,,,,,,1,,1,,,,,,,,,,1,,,,,,1,,,,1,,,,,,1,,,,1,,,,,,,,,,,20-24,female,university degree,,1,,,1,,,,urban area,South,1,,,,,1,,,,,Learn Learn and again teach like this is the life of a student person sees something in the future and because of this not reuşelte theory to alice year practice in the future and because of this it fails as a theory to apply in practice: therefore I miss however experience during my life I tried to get out of this routine me getting involved in projects that are failing firm exercises trying to learn as much reality to înţăleg of all! From here I can say that I have a little experience!,How to apply theory in practice?,,,,,,,,,foimoldova2015,SenseMaker New WebCollector; Mozilla/5.0 (Windows NT 6.3; WOW64) AppleWebKit/537.36 (KHTML like Gecko) Chrome/48.0.2564.22 Safari/537.36,,,ro
3cc73e01-d500-4fee-ba74-2b2bfce3c1ea,84,2015/12/03 18:20:09.055,2015/12/03 18:19:05.171,3.8490965,90.81633,5.334575,0.5074274,0.7864694,,5.9617724,90.81633,3.2218993,0.48630062,0.7864694,,5.665713,90.0,4.334287,0.49334288,0.7794,,33.88503,32.85715,33.25782,0.496864,0.28454286,,5.1095214,90.408165,4.4823146,0.496864,0.7829347,,31.920385,33.265305,34.81431,0.5144696,0.28807753,,32.42053,33.67347,33.906006,0.5074274,0.29161227,,33.68095,33.265305,33.053745,0.496864,0.28807753,,4.875259,45.102043,50.022697,0.7257372,0.3905837,,31.196033,36.122448,32.68151,0.5074274,0.3128204,,0.035909116,0.9640909,0.9640909,,positive,it's rare but happens occasionally,1,,,,,,,,,,,,,,,,,,,,,,,,,1,,,,1,,,,,,,,,,,,,,,,,,,,,,,,,1,,,,,,20-24,male,complete secondary,,,1,,1,1,,,urban area,South,,,1,,1,1,,,,,I was involved in News,I was involved in News,,,,,,,,,foimoldova2015,SenseMaker New WebCollector; Mozilla/5.0 (Windows NT 6.3; WOW64) AppleWebKit/537.36 (KHTML like Gecko) Chrome/48.0.2564.22 Safari/537.36,,,ro
5039f48b-cd24-48a1-a95d-fe0a075c86a3,85,2015/12/03 19:24:05.009,2015/12/03 19:23:01.405,8.8764105,48.367344,42.756245,0.6693992,0.4188612,,47.61311,40.612244,11.774642,0.32080767,0.35170203,,9.712849,43.877556,46.4096,0.6834837,0.3799796,,44.961487,10.0,45.03851,0.5003851,0.08660002,,34.609375,30.000002,35.390625,0.50390625,0.25980002,,10.937339,41.428574,47.634087,0.6834837,0.35877144,,,,,,,1,33.124756,33.67347,33.20178,0.5003851,0.29161227,,26.037947,47.142857,26.819197,0.50390625,0.40825716,,,,,,,1,0.0068181753,0.9931818,0.9931818,,negative,it's very common,1,,,,,,,,,,,,,,,1,,,,,,,,1,,1,,,1,,1,,,,1,,,,,,,,,,,1,,,,1,,,,,,,,1,,,20-24,female,university degree,,1,,,,,,,urban area,Center,,,1,,,1,,,,,We are a third without government students did not feature the support from the state and society,We are a third without government students did not feature the support from the state and society,0.15126708,0.49588817,0.07381833,0.328125,0.24010535,0.4169408,0.20138098,0.19654608,foimoldova2015,SenseMaker New WebCollector; Mozilla/5.0 (Windows NT 6.3; WOW64) AppleWebKit/537.36 (KHTML like Gecko) Chrome/48.0.2564.22 Safari/537.36,,,ro
7ad117ce-3c17-4b59-8751-f819efbdd856,86,2015/12/03 19:00:13.120,2015/12/03 18:59:09.603,6.2420263,86.7347,7.0232763,0.50390625,0.7511225,,7.558501,85.51021,6.931294,0.496864,0.7405184,,6.6933126,8.367348,84.93935,0.89123017,0.07246123,,6.1931653,7.9591827,85.84766,0.89827245,0.068926506,,6.150049,85.51021,8.339746,0.5109485,0.7405184,,6.4461083,86.32653,7.2273583,0.50390625,0.74758774,,83.24979,8.775505,7.974704,0.12362456,0.0759959,,88.79161,7.551018,3.65737,0.07432879,0.06539184,,3.961201,89.18367,6.8551273,0.5144696,0.77233064,,7.7697716,5.510208,86.72002,0.8947513,0.047718376,,0.1340909,0.8659091,0.8659091,,positive,it's somewhat common,1,,,,,,,,,,,,,,,,,,1,1,,,,1,,,,,1,1,,1,,,,,,,,,,,,,,1,,,,,1,,,,,,,,,,20-24,female,university degree,,,1,,1,,,,urban area,Center,,,1,,,1,,,,,Installing cameras for cars nerespectătorii driving rules. Offer a motivating drivers to be more safety driving perecauţi,A new stage,,,,,,,,,foimoldova2015,SenseMaker New WebCollector; Mozilla/5.0 (Windows NT 6.3; WOW64) AppleWebKit/537.36 (KHTML like Gecko) Chrome/48.0.2564.22 Safari/537.36,,,ro
881c4b8d-12fa-482c-b8be-d5166dc4d75c,87,2015/12/03 18:01:49.498,2015/12/03 18:00:46.024,16.706244,65.102036,18.191721,0.5074274,0.56378365,,,,,,,1,16.900259,16.122452,66.977295,0.7503851,0.13962041,,15.991958,16.530617,67.47743,0.7574274,0.14315513,,15.221618,68.77551,16.002869,0.50390625,0.5955959,,,,,,,1,,,,,,1,79.46853,10.0,10.531469,0.1553147,0.08660002,,16.354134,65.102036,18.54383,0.5109485,0.56378365,,,,,,,1,0.014090896,0.9859091,0.9859091,,strongly negative,it's somewhat common,1,,,,,,,,,,,,,,,,,,,,,1,,,,,1,educația,,1,,,,,,,,,,,,,,,,1,,,,,,,,,,,,,,,20-24,female,university degree,,1,,,,,,,urban area,Center,,,,1,,1,,,,,Profile: Who dared to think of next?,Who dared to think of next?,0.18087985,0.24917763,0.4883969,0.13404608,0.7936361,0.6932566,0.4701737,0.68667763,foimoldova2015,SenseMaker New WebCollector; Mozilla/5.0 (Windows NT 6.3; WOW64) AppleWebKit/537.36 (KHTML like Gecko) Chrome/48.0.2564.22 Safari/537.36,,,ro
8d11f8a7-9e8a-4342-a147-044907bc8f92,88,2015/12/03 17:34:17.828,2015/12/03 17:33:13.981,7.157523,6.7346954,86.10779,0.8947513,0.05832244,,6.509339,5.9183655,87.572296,0.9053147,0.051253047,,35.721767,29.18367,35.09456,0.496864,0.2527306,,,,,,,1,,,,,,1,,,,,,1,,,,,,1,,,,,,1,,,,,,1,,,,,,1,,,,1,negative,it's very common,,,,,1,,1,,,,,,,,,1,,,,,,,,,,1,,,,,1,,,1,,,1,,,,,,,,,1,,,,,1,,,,1,,,,,,20-24,male,university degree,,,,,1,,,,urban area,Center,,,1,,,1,,,,,Theft billion of RM,RM shock,,,,,,,,,foimoldova2015,SenseMaker New WebCollector; Mozilla/5.0 (Windows NT 6.3; WOW64) AppleWebKit/537.36 (KHTML like Gecko) Chrome/48.0.2564.22 Safari/537.36,,,ro
9f972780-3ae8-4e49-b836-899e06de7126,89,2015/12/03 19:08:38.757,2015/12/03 19:07:35.215,4.0028806,47.551014,48.446102,0.7222161,0.4117918,,,,,,,1,6.02501,10.408165,83.566826,0.8877091,0.090134695,,92.74103,3.8775485,3.381429,0.053202026,0.033579584,,6.2420263,86.7347,7.0232763,0.50390625,0.7511225,,2.6921701,5.1020355,92.205795,0.94756824,0.044183653,,,,,,,1,,,,,,1,,,,,,1,,,,,,1,,,,1,strongly negative,it's somewhat common,1,,,,,,,,,,,,,,,1,,,,,,,,,,,,,,,,,,,,,1,,,,,,,,,,,,,,,,,,1,,,,,,20-24,female,some university (no degree),,,,,1,,,,urban area,Center,,,1,,,1,,,,,Moldovan parliament recently adopted a law which amends the 4000 lei vehicle owner if that allowed a person without driving its climb behind the wheel. The problem is not this but the reasoning was given later by an official because we need money to beget. Sorry that this is exactly gather money in the budget.,New sources state budget,0.2606065,0.2162829,0.16721241,0.38404608,0.10115319,0.13075656,0.14443336,0.7458881,foimoldova2015,SenseMaker New WebCollector; Mozilla/5.0 (Windows NT 6.3; WOW64) AppleWebKit/537.36 (KHTML like Gecko) Chrome/48.0.2564.22 Safari/537.36,,,ro
a14931eb-79c0-4d8d-999d-06bb21ecf8af,90,2015/12/03 17:39:24.517,2015/12/03 17:38:20.646,90.016106,5.1020355,4.881861,0.07432879,0.044183653,,4.6366906,7.551018,87.812294,0.91587806,0.06539184,,6.7694783,4.693878,88.53664,0.9088358,0.040648982,,5.2489295,6.326531,88.42454,0.91587806,0.05478777,,32.51251,34.897957,32.58953,0.5003851,0.30221632,,4.961489,90.0,5.038511,0.5003851,0.7794,,7.4535856,7.551018,84.9954,0.8877091,0.06539184,,4.9370594,0.61224365,94.45069,0.94756824,0.005302059,,88.755684,5.510208,5.7341123,0.08489217,0.047718376,,4.1006174,5.1020355,90.797356,0.9334837,0.044183653,,0.021363616,0.9786364,0.9786364,,neutral,it's somewhat common,1,,,,,,1,,,,,,,,,1,,,,,,,,,,1,,,,,1,1,,,,,,,,,1,,,,,,,,,,,,,,,1,,,,,17-19,female,complete secondary,,,,,1,,,,urban area,South,,,1,,,,,,1,salariu părinților,I have had no experience,A decent life more,,,,,,,,,foimoldova2015,SenseMaker New WebCollector; Mozilla/5.0 (Windows NT 6.3; WOW64) AppleWebKit/537.36 (KHTML like Gecko) Chrome/48.0.2564.22 Safari/537.36,,,ro
c902d284-a2ee-4595-85b5-e44ad62f578a,91,2015/12/03 17:27:23.884,2015/12/03 17:26:20.128,34.293194,32.040817,33.665985,0.496864,0.27747348,,5.425703,88.36734,6.206953,0.50390625,0.76526123,,0.14545165,52.448982,47.405567,0.7363006,0.45420814,,50.487507,3.8775482,45.634945,0.47573724,0.033579584,,4.553325,90.81633,4.630347,0.5003851,0.7864694,,47.76259,5.1020355,47.13538,0.496864,0.044183653,,,,,,,1,,,,,,1,89.86807,4.6938777,5.438051,0.07784991,0.040648982,,4.8192043,45.91837,49.262424,0.7222161,0.39765307,,,,,1,strongly negative,it's a one-time occurrence,1,,,,,,,,,,,1,,,,1,,,,,,,,,,,,,1,,1,,1,,,,,,,,,,,,,1,,,,1,,,,,,,,1,,,20-24,female,university degree,,,,,1,,,,rural area,Center,,,,1,,1,,,,,Theft billion of the country's economy (budget) aggravated the situation and worried,the billion theft,,,,,,,,,foimoldova2015,SenseMaker New WebCollector; Mozilla/5.0 (Windows NT 6.3; WOW64) AppleWebKit/537.36 (KHTML like Gecko) Chrome/48.0.2564.22 Safari/537.36,,,ro
d8b7ec0e-8d77-4fdd-b922-35a5375bf530,92,2015/12/03 18:46:07.202,2015/12/03 18:45:03.645,0.9100317,43.877556,55.212414,0.7715119,0.3799796,,29.031622,29.18367,41.784706,0.5637654,0.2527306,,31.175917,38.97959,29.844492,0.49334288,0.33756325,,35.64559,32.85715,31.497261,0.47925836,0.28454286,,27.771204,29.591835,42.63696,0.5743288,0.25626528,,24.730093,32.85715,42.412758,0.5884133,0.28454286,,36.385746,34.897957,28.716293,0.46165273,0.30221632,,33.82898,33.67347,32.497555,0.49334288,0.29161227,,33.384888,32.448975,34.166138,0.50390625,0.28100815,,35.2015,31.63265,33.165848,0.48982173,0.2739388,,,,,1,positive,it's a one-time occurrence,,1,,,1,,1,,,,,,,,,,,1,1,,,,,,,,,,,,,,,,,,,1,1,,,,,,,,,,1,,,,,,,,,,,,20-24,female,university degree,,,,,1,,,,rural area,Center,,,1,,,1,,,,,It was launched the most active young man from my town!,civic activism,0.8141372,0.75575656,0.22416002,0.6899671,0.5407887,0.24588817,,,foimoldova2015,SenseMaker New WebCollector; Mozilla/5.0 (Windows NT 6.3; WOW64) AppleWebKit/537.36 (KHTML like Gecko) Chrome/48.0.2564.22 Safari/537.36,,,ro
da1c4ea7-cb58-46b9-9f9e-5f45d8b6824e,93,2015/12/03 18:14:39.235,2015/12/03 18:13:35.729,5.573735,88.77551,5.650757,0.5003851,0.7687959,,32.476578,32.85715,34.66627,0.5109485,0.28454286,,32.032482,31.63265,36.334866,0.5215119,0.2739388,,7.805704,7.551018,84.64328,0.88418794,0.06539184,,6.4461083,86.32653,7.2273583,0.50390625,0.74758774,,5.3552833,48.367344,46.277374,0.70461047,0.4188612,,,,,,,1,,,,,,1,6.650191,85.918365,7.431441,0.50390625,0.74405307,,77.39178,12.040817,01.10.5674,0.16587809,0.10427348,,,,,1,strongly positive,it's rare but happens occasionally,1,,,,,,1,,,,,,1,,,,,1,,,,,,,,,,,1,,,,,,1,,,1,,,,,,,,,,,,1,,,,,,,,,,,20-24,female,university degree,,,,,1,,,,urban area,Center,,,1,,,,,,1,bursă,I was impressed by how Moldovans / population in our country compatinuit jertvele wounded people who suffer terrorist attacks. This showed that we are next to the people that we care.,we are next to the people we care,0.2674402,0.34786183,0.19682518,0.49588817,0.092041574,0.37088817,0.19910307,0.19325656,foimoldova2015,SenseMaker New WebCollector; Mozilla/5.0 (Windows NT 6.3; WOW64) AppleWebKit/537.36 (KHTML like Gecko) Chrome/48.0.2564.22 Safari/537.36,,,ro
60a2df13-068d-4696-971a-0189a8998e0e,94,2015/12/07 22:12:30.643,2015/12/07 22:12:29.676,,,,,,1,,,,,,1,6.4532943,6.7346954,86.81201,0.9017936,0.05832244,,87.23512,7.1428604,5.622013,0.09193442,0.061857164,,5.3136034,90.0,4.6863966,0.496864,0.7794,,,,,,,1,,,,,,1,5.221621,88.77551,6.002871,0.50390625,0.7687959,,6.686123,87.95918,5.354697,0.49334288,0.7617265,,,,,,,1,,,,1,negative,it's somewhat common,1,,,,,,,,1,,,,,,,1,,,,,,,,,,,,,,,,,,,,,,,,,,,,1,Lipsa de acțiune,,,,,1,,,,,,,,,,,17-19,female,complete secondary,,,,,1,1,,,rural area,Center,,,1,,,,,,1,părinții,The sky right now as to say that Moldovan society has problems. Is the lack of action that would contribute to the progress of society. So sicietatea changing needs repair two schools. Be open sports grounds. This is not done or occurs rarely.,We tend to Europe but nothing purposes înterprindem,,,,,,,,,foimoldova2015,SenseMaker New WebCollector; Mozilla/5.0 (Windows NT 6.1) AppleWebKit/537.36 (KHTML like Gecko) Chrome/46.0.2490.86 Safari/537.36,,,ro
ae305c98-4966-44fc-affd-002c226b28ac,95,2015/12/13 16:25:50.832,2015/12/13 16:26:58.526,15.731563,13.404931,70.8635,0.77565974,0.11608669,,1.5845411,95.15266,3.2628026,0.5083913,0.824022,,2.4789639,2.249588,95.27145,0.96396244,0.01948142,,94.30626,3.5568616,2.1368723,0.039153032,0.030802403,,93.02242,4.437767,2.5398176,0.047587015,0.038431074,,0.37803268,0.68087006,98.94109,0.9928153,0.0058963327,,,,,,,1,33.456768,32.92677,33.616455,0.50079846,0.28514585,,95.373215,1.726677,2.900105,0.037634436,0.014953006,,32.611656,32.491005,34.89734,0.5114284,0.2813721,,0.52,0.48,0.48,,negative,it's a one-time occurrence,1,,,1,1,,,,,,,,,,,1,,,,,,,1,1,,,,,,,,,,,,,1,,1,,,1,,,,1,,,,1,,,,,,,1,,,,20-24,male,university degree,1,,,,,,1,munca,rural area,South,,,,1,,1,,,,,National Square protest,a better future,0.18250193,0.23412669,0.48209307,0.30964953,0.51528394,0.6841814,0.838458,0.63486034,foimoldova2015,SenseMaker Android Collector,0.0,0.0,ro
6c45320b-f97f-4fc4-83f0-a87a8431f99c,96,2015/12/22 23:55:32.621,2015/12/22 23:56:22.975,0.3926489,74.48979,25.117561,0.62362456,0.64508164,,0.5866675,25.5102,73.90314,0.86658233,0.22091836,,0.07359375,48.367344,51.55906,0.7574274,0.4188612,,0.0054535065,23.874945,76.1196,0.8806668,0.20677957,,0.22161867,48.775513,51.002872,0.75390625,0.42239594,,0.020412598,77.34694,22.63265,0.6130612,0.6698245,,1.4518625,2.653061,95.89507,0.9722161,0.02297552,,2.156091,2.653061,95.19085,0.96517384,0.02297552,,,,,,,1,0.56367016,0.20407867,99.23225,0.9933429,0.0017673358,,0.9886364,0.011363637,0.011363637,,strongly positive,it's very common,1,,1,,,,,,,1,,,,,,,,,,,,,,,,,,,1,1,,,,,,,,,,1,,,,,,1,,,1,,,,,,,1,,,,,17-19,male,complete secondary,,,,1,,,,,rural area,South,,,1,1,,,,,1,,Today I was in Comrat and I drove school.,Auto School in Comrat,0.17632402,0.7228619,0.45650625,0.6603619,0.83691627,0.640625,0.725299,0.75575656,foimoldova2015,SenseMaker New WebCollector; Mozilla/5.0 (Windows NT 6.1; WOW64) AppleWebKit/537.36 (KHTML like Gecko) Chrome/47.0.2526.106 Safari/537.36,,,ro
